{
    "id": "kee-auth",
    "position": 10,
    "path": "/kee-auth",
    "title": "projects:projects.kee-auth.name",
    "description": "projects:projects.kee-auth.description",
    "tags": [
        "Library",
        "Security",
        "KumuluzEE"
    ],
    "license": "MIT",
    "fullDescription": "projects:projects.kee-auth.full-description",
    "distribution": {
        "type": "link",
        "url": "https://mvnrepository.com/artifact/com.mjamsek.auth/kee-auth"
    },
    "repository": {
        "provider": "github",
        "url": "kee-auth"
    },
    "images": [
        "/images/projects/kee-auth/keycloak.jpg",
        "/images/projects/kee-auth/kumuluzee.png"
    ]
}
